VRM_SubCategory__c,VRM_External_Id__c,Name,VRM_Category__c,VRM_Failure_Resolution_Code__c,WOD_2__Status__c
0ZGVF0000002fHx4AI,Electrical Components-Fuses & Circuit Breakers-Grounding Block Defective-Replace Component-1hr,FaultCode853,0ZGVF0000002fFG4AY,a85VF000000vQu7YAE,True
0ZGVF0000002fHx4AI,Electrical Components-Fuses & Circuit Breakers-Housing Damaged-Replace Component-1hr,FaultCode854,0ZGVF0000002fFG4AY,a85VF000000vQu8YAE,True
0ZGVF0000002fHx4AI,Electrical Components-Fuses & Circuit Breakers-Intermittent Operations-Replace Component-1hr,FaultCode855,0ZGVF0000002fFG4AY,a85VF000000vQu9YAE,True
0ZGVF0000002fHx4AI,Electrical Components-Fuses & Circuit Breakers-Leads corroded/broken-Replace Component-1hr,FaultCode856,0ZGVF0000002fFG4AY,a85VF000000vQuAYAU,True
0ZGVF0000002fHx4AI,Electrical Components-Fuses & Circuit Breakers-Mis-manufactured-Replace Component-1hr,FaultCode857,0ZGVF0000002fFG4AY,a85VF000000vQtqYAE,True
0ZGVF0000002fHx4AI,Electrical Components-Fuses & Circuit Breakers-Other -- Fill in Comments-Replace Component-1hr,FaultCode858,0ZGVF0000002fFG4AY,a85VF000000vQttYAE,True
0ZGVF0000002fHx4AI,Electrical Components-Fuses & Circuit Breakers-Shipment Damage-Replace Component-0hr,FaultCode859,0ZGVF0000002fFG4AY,a85VF000000vQtvYAE,True
0ZGVF0000002fHy4AI,Electrical Components-Micro Switches-Factory Wiring Loose-Repair Wiring-1hr,FaultCode860,0ZGVF0000002fFG4AY,a85VF000000vQvSYAU,True
0ZGVF0000002fHy4AI,Electrical Components-Micro Switches-Mis-manufactured-Replace Component-1hr,FaultCode861,0ZGVF0000002fFG4AY,a85VF000000vQtqYAE,True
0ZGVF0000002fHy4AI,Electrical Components-Micro Switches-Other -- Fill in Comments-Replace Component-1hr,FaultCode862,0ZGVF0000002fFG4AY,a85VF000000vQttYAE,True
0ZGVF0000002fHy4AI,Electrical Components-Micro Switches-Run Microswitch Fails Open-Replace Component-1hr,FaultCode863,0ZGVF0000002fFG4AY,a85VF000000vQx5YAE,True
0ZGVF0000002fHy4AI,Electrical Components-Micro Switches-Safety Microswitch Fails Closed-Replace Component-1hr,FaultCode864,0ZGVF0000002fFG4AY,a85VF000000vQx6YAE,True
0ZGVF0000002fHy4AI,Electrical Components-Micro Switches-Shipment Damage-Replace Component-0hr,FaultCode865,0ZGVF0000002fFG4AY,a85VF000000vQtvYAE,True
0ZGVF0000002fHy4AI,Electrical Components-Micro Switches-Tower Ahead Forward-Replace Component-1hr,FaultCode866,0ZGVF0000002fFG4AY,a85VF000000vQxCYAU,True
0ZGVF0000002fHy4AI,Electrical Components-Micro Switches-Tower Ahead Reverse-Replace Component-1hr,FaultCode867,0ZGVF0000002fFG4AY,a85VF000000vQxGYAU,True
0ZGVF0000002fHy4AI,Electrical Components-Micro Switches-Tower Behind Forward-Replace Component-1hr,FaultCode868,0ZGVF0000002fFG4AY,a85VF000000vQxDYAU,True
0ZGVF0000002fHy4AI,Electrical Components-Micro Switches-Tower Behind Reverse-Replace Component-1hr,FaultCode869,0ZGVF0000002fFG4AY,a85VF000000vQxEYAU,True
0ZGVF0000002fHz4AI,Electrical Components-Percent Timers-Electrical Specs Not Met-Replace Component-1hr,FaultCode870,0ZGVF0000002fFG4AY,a85VF000000vQu5YAE,True
0ZGVF0000002fHz4AI,Electrical Components-Percent Timers-Factory Wiring Incorrect-Repair Wiring-1hr,FaultCode871,0ZGVF0000002fFG4AY,a85VF000000vQv9YAE,True
0ZGVF0000002fHz4AI,Electrical Components-Percent Timers-Mis-manufactured-Replace Component-1hr,FaultCode872,0ZGVF0000002fFG4AY,a85VF000000vQtqYAE,True
0ZGVF0000002fHz4AI,Electrical Components-Percent Timers-Other -- Fill in Comments-Replace Component-1hr,FaultCode873,0ZGVF0000002fFG4AY,a85VF000000vQttYAE,True
0ZGVF0000002fHz4AI,Electrical Components-Percent Timers-OW Timer Doesn't Break Safety-Replace Component-1hr,FaultCode874,0ZGVF0000002fFG4AY,a85VF000000vQx2YAE,True
0ZGVF0000002fHz4AI,Electrical Components-Percent Timers-OW Timer Doesn't Hold Safety-Replace Component-1hr,FaultCode875,0ZGVF0000002fFG4AY,a85VF000000vQx3YAE,True
0ZGVF0000002fHz4AI,Electrical Components-Percent Timers-Percent timer runs at 100% at all times-Replace Component-1hr,FaultCode876,0ZGVF0000002fFG4AY,a85VF000000vQupYAE,True
0ZGVF0000002fHz4AI,Electrical Components-Percent Timers-Shipment Damage-Replace Component-0hr,FaultCode877,0ZGVF0000002fFG4AY,a85VF000000vQtvYAE,True
0ZGVF0000002fI04AI,Electrical Components-Power Supply-12 Volt Power Supply-Replace Component-1hr,FaultCode878,0ZGVF0000002fFG4AY,a85VF000000vQxOYAU,True
0ZGVF0000002fI04AI,Electrical Components-Power Supply-5 Volt Power Supply-Replace Component-1hr,FaultCode879,0ZGVF0000002fFG4AY,a85VF000000vQugYAE,True
0ZGVF0000002fI04AI,Electrical Components-Power Supply-Mis-manufactured-Replace Component-1hr,FaultCode880,0ZGVF0000002fFG4AY,a85VF000000vQtqYAE,True
0ZGVF0000002fI04AI,Electrical Components-Power Supply-Other -- Fill in Comments-Replace Component-1hr,FaultCode881,0ZGVF0000002fFG4AY,a85VF000000vQttYAE,True
0ZGVF0000002fI04AI,Electrical Components-Power Supply-Shipment Damage-Replace Component-0hr,FaultCode882,0ZGVF0000002fFG4AY,a85VF000000vQtvYAE,True
0ZGVF0000002fI94AI,Electrical Components-Pressure Switches-Electrical Component Failure-Replace Component-1hr,FaultCode883,0ZGVF0000002fFG4AY,a85VF000000vQu4YAE,True
0ZGVF0000002fI94AI,Electrical Components-Pressure Switches-Electrical Specs Not Met-Replace Component-1hr,FaultCode884,0ZGVF0000002fFG4AY,a85VF000000vQu5YAE,True
0ZGVF0000002fI94AI,Electrical Components-Pressure Switches-Low Pressure Switch Fails Closed-Replace Component-1hr,FaultCode885,0ZGVF0000002fFG4AY,a85VF000000vQvFYAU,True
0ZGVF0000002fI94AI,Electrical Components-Pressure Switches-Low Pressure Switch Fails Open-Replace Component-1hr,FaultCode886,0ZGVF0000002fFG4AY,a85VF000000vQvGYAU,True
0ZGVF0000002fI94AI,Electrical Components-Pressure Switches-Mis-manufactured-Replace Component-1hr,FaultCode887,0ZGVF0000002fFG4AY,a85VF000000vQtqYAE,True
0ZGVF0000002fI94AI,Electrical Components-Pressure Switches-Other -- Fill in Comments-Replace Component-1hr,FaultCode888,0ZGVF0000002fFG4AY,a85VF000000vQttYAE,True
0ZGVF0000002fI94AI,Electrical Components-Pressure Switches-Shipment Damage-Replace Component-0hr,FaultCode889,0ZGVF0000002fFG4AY,a85VF000000vQtvYAE,True
0ZGVF0000002fI94AI,Electrical Components-Pressure Switches-Switch Failure-Replace Component-1hr,FaultCode890,0ZGVF0000002fFG4AY,a85VF000000vQvHYAU,True
0ZGVF0000002fI14AI,Electrical Components-Pressure Transducers-Calibration changed/out of spec-Replace Component-1hr,FaultCode891,0ZGVF0000002fFG4AY,a85VF000000vQtxYAE,True
0ZGVF0000002fI14AI,Electrical Components-Pressure Transducers-Leads corroded/broken-Replace Component-1hr,FaultCode892,0ZGVF0000002fFG4AY,a85VF000000vQuAYAU,True
0ZGVF0000002fI14AI,Electrical Components-Pressure Transducers-Mis-manufactured-Replace Component-1hr,FaultCode893,0ZGVF0000002fFG4AY,a85VF000000vQtqYAE,True
0ZGVF0000002fI14AI,Electrical Components-Pressure Transducers-Other -- Fill in Comments-Replace Component-1hr,FaultCode894,0ZGVF0000002fFG4AY,a85VF000000vQttYAE,True
0ZGVF0000002fI14AI,Electrical Components-Pressure Transducers-Pressure Reading Incorrect-Replace Component-1hr,FaultCode895,0ZGVF0000002fFG4AY,a85VF000000vQuqYAE,True
0ZGVF0000002fI14AI,Electrical Components-Pressure Transducers-Shipment Damage-Replace Component-0hr,FaultCode896,0ZGVF0000002fFG4AY,a85VF000000vQtvYAE,True
0ZGVF0000002fI24AI,Electrical Components-Relays-Calibration changed/out of spec-Replace Component-1hr,FaultCode897,0ZGVF0000002fFG4AY,a85VF000000vQtxYAE,True
0ZGVF0000002fI24AI,Electrical Components-Relays-Coil Failure-Replace Component-1hr,FaultCode898,0ZGVF0000002fFG4AY,a85VF000000vQtpYAE,True
0ZGVF0000002fI24AI,Electrical Components-Relays-Contact Points Burned-Replace Component-1hr,FaultCode899,0ZGVF0000002fFG4AY,a85VF000000vQtyYAE,True
0ZGVF0000002fI24AI,Electrical Components-Relays-Contact Points Damaged-Replace Component-1hr,FaultCode900,0ZGVF0000002fFG4AY,a85VF000000vQvEYAU,True
0ZGVF0000002fI24AI,Electrical Components-Relays-Electrical Component Failure-Replace Component-1hr,FaultCode901,0ZGVF0000002fFG4AY,a85VF000000vQu4YAE,True
0ZGVF0000002fI24AI,Electrical Components-Relays-Electrical Specs Not Met-Replace Component-1hr,FaultCode902,0ZGVF0000002fFG4AY,a85VF000000vQu5YAE,True
0ZGVF0000002fI24AI,Electrical Components-Relays-Factory Wiring Incorrect-Replace Component-1hr,FaultCode903,0ZGVF0000002fFG4AY,a85VF000000vQvDYAU,True
0ZGVF0000002fI24AI,Electrical Components-Relays-Factory Wiring Incorrect-Repair Wiring-1hr,FaultCode904,0ZGVF0000002fFG4AY,a85VF000000vQv9YAE,True
0ZGVF0000002fI24AI,Electrical Components-Relays-Factory Wiring Loose-Repair Wiring-1hr,FaultCode905,0ZGVF0000002fFG4AY,a85VF000000vQvSYAU,True
0ZGVF0000002fI24AI,Electrical Components-Relays-Intermittent Operations-Replace Component-1hr,FaultCode906,0ZGVF0000002fFG4AY,a85VF000000vQu9YAE,True
0ZGVF0000002fI24AI,Electrical Components-Relays-Mis-manufactured-Replace Component-1hr,FaultCode907,0ZGVF0000002fFG4AY,a85VF000000vQtqYAE,True
0ZGVF0000002fI24AI,Electrical Components-Relays-Other -- Fill in Comments-Replace Component-1hr,FaultCode908,0ZGVF0000002fFG4AY,a85VF000000vQttYAE,True
0ZGVF0000002fI24AI,Electrical Components-Relays-Shipment Damage-Replace Component-0hr,FaultCode909,0ZGVF0000002fFG4AY,a85VF000000vQtvYAE,True
0ZGVF0000002fI34AI,Electrical Components-Solenoids-Coil Failure-Replace Component-1hr,FaultCode910,0ZGVF0000002fFG4AY,a85VF000000vQtpYAE,True
0ZGVF0000002fI34AI,Electrical Components-Solenoids-Leaking-Replace Component-1hr,FaultCode911,0ZGVF0000002fFG4AY,a85VF000000vQtrYAE,True
0ZGVF0000002fI34AI,Electrical Components-Solenoids-Other -- Fill in Comments-Replace Component-1hr,FaultCode912,0ZGVF0000002fFG4AY,a85VF000000vQttYAE,True
0ZGVF0000002fI34AI,Electrical Components-Solenoids-Shipment Damage-Replace Component-0hr,FaultCode913,0ZGVF0000002fFG4AY,a85VF000000vQtvYAE,True
0ZGVF0000002fI34AI,Electrical Components-Solenoids-Won't close-Replace Component-1hr,FaultCode914,0ZGVF0000002fFG4AY,a85VF000000vQtsYAE,True
0ZGVF0000002fI44AI,Electrical Components-Speciality Cables-Other -- Fill in Comments-Replace Component-1hr,FaultCode915,0ZGVF0000002fFG4AY,a85VF000000vQttYAE,True
0ZGVF0000002fI44AI,Electrical Components-Speciality Cables-Shipment Damage-Replace Component-0hr,FaultCode916,0ZGVF0000002fFG4AY,a85VF000000vQtvYAE,True
0ZGVF0000002fI44AI,Electrical Components-Speciality Cables-Mis-manufactured-Replace Component-1hr,FaultCode917,0ZGVF0000002fFG4AY,a85VF000000vQtqYAE,True
0ZGVF0000002fI54AI,Electrical Components-Switches-Calibration changed/out of spec-Replace Component-1hr,FaultCode918,0ZGVF0000002fFG4AY,a85VF000000vQtxYAE,True
0ZGVF0000002fI54AI,Electrical Components-Switches-Contact Points Burned-Replace Component-1hr,FaultCode919,0ZGVF0000002fFG4AY,a85VF000000vQtyYAE,True
0ZGVF0000002fI54AI,Electrical Components-Switches-Contact Points Damaged-Replace Component-1hr,FaultCode920,0ZGVF0000002fFG4AY,a85VF000000vQvEYAU,True
0ZGVF0000002fI54AI,Electrical Components-Switches-Electrical Specs Not Met-Replace Component-1hr,FaultCode921,0ZGVF0000002fFG4AY,a85VF000000vQu5YAE,True
0ZGVF0000002fI54AI,Electrical Components-Switches-Intermittent Operations-Replace Component-1hr,FaultCode922,0ZGVF0000002fFG4AY,a85VF000000vQu9YAE,True
0ZGVF0000002fI54AI,Electrical Components-Switches-Leads corroded/broken-Replace Component-1hr,FaultCode923,0ZGVF0000002fFG4AY,a85VF000000vQuAYAU,True
0ZGVF0000002fI54AI,Electrical Components-Switches-Mis-manufactured-Replace Component-1hr,FaultCode924,0ZGVF0000002fFG4AY,a85VF000000vQtqYAE,True
0ZGVF0000002fI54AI,Electrical Components-Switches-Other -- Fill in Comments-Replace Component-1hr,FaultCode925,0ZGVF0000002fFG4AY,a85VF000000vQttYAE,True
0ZGVF0000002fI54AI,Electrical Components-Switches-Shipment Damage-Replace Component-0hr,FaultCode926,0ZGVF0000002fFG4AY,a85VF000000vQtvYAE,True
0ZGVF0000002fIA4AY,Electrical Components-Terminal Options-Calibration changed/out of spec-Replace Component-1hr,FaultCode927,0ZGVF0000002fFG4AY,a85VF000000vQtxYAE,True
0ZGVF0000002fIA4AY,Electrical Components-Terminal Options-Contact Points Burned-Replace Component-1hr,FaultCode928,0ZGVF0000002fFG4AY,a85VF000000vQtyYAE,True
0ZGVF0000002fIA4AY,Electrical Components-Terminal Options-Contactor not pulling in-Replace Component-1hr,FaultCode929,0ZGVF0000002fFG4AY,a85VF000000vQu1YAE,True
0ZGVF0000002fIA4AY,Electrical Components-Terminal Options-Electrical Component Failure-Replace Component-1hr,FaultCode930,0ZGVF0000002fFG4AY,a85VF000000vQu4YAE,True
0ZGVF0000002fIA4AY,Electrical Components-Terminal Options-Electrical Specs Not Met-Replace Component-1hr,FaultCode931,0ZGVF0000002fFG4AY,a85VF000000vQu5YAE,True
0ZGVF0000002fIA4AY,Electrical Components-Terminal Options-Fuse Block Defective-Replace Component-1hr,FaultCode932,0ZGVF0000002fFG4AY,a85VF000000vQu6YAE,True
0ZGVF0000002fIA4AY,Electrical Components-Terminal Options-Grounding Block Defective-Replace Component-1hr,FaultCode933,0ZGVF0000002fFG4AY,a85VF000000vQu7YAE,True
0ZGVF0000002fIA4AY,Electrical Components-Terminal Options-Housing Damaged-Replace Component-1hr,FaultCode934,0ZGVF0000002fFG4AY,a85VF000000vQu8YAE,True
0ZGVF0000002fIA4AY,Electrical Components-Terminal Options-Intermittent Operations-Replace Component-1hr,FaultCode935,0ZGVF0000002fFG4AY,a85VF000000vQu9YAE,True
0ZGVF0000002fIA4AY,Electrical Components-Terminal Options-Leads corroded/broken-Replace Component-1hr,FaultCode936,0ZGVF0000002fFG4AY,a85VF000000vQuAYAU,True
0ZGVF0000002fIA4AY,Electrical Components-Terminal Options-Mis-manufactured-Replace Component-1hr,FaultCode937,0ZGVF0000002fFG4AY,a85VF000000vQtqYAE,True
0ZGVF0000002fIA4AY,Electrical Components-Terminal Options-Other -- Fill in Comments-Replace Component-1hr,FaultCode938,0ZGVF0000002fFG4AY,a85VF000000vQttYAE,True
0ZGVF0000002fIA4AY,Electrical Components-Terminal Options-Shipment Damage-Replace Component-0hr,FaultCode939,0ZGVF0000002fFG4AY,a85VF000000vQtvYAE,True
0ZGVF0000002fID4AY,Flotation-Articulating 4-Wheel Drive-Other -- Fill in Comments-Replace Component-1hr,FaultCode940,0ZGVF0000002fFH4AY,a85VF000000vQttYAE,True
0ZGVF0000002fID4AY,Flotation-Articulating 4-Wheel Drive-Shipment Damage-Replace Component-0hr,FaultCode941,0ZGVF0000002fFH4AY,a85VF000000vQtvYAE,True
0ZGVF0000002fID4AY,Flotation-Articulating 4-Wheel Drive-Mis-manufactured-Replace Component-1hr,FaultCode942,0ZGVF0000002fFH4AY,a85VF000000vQtqYAE,True
0ZGVF0000002fIJ4AY,Linears-Below Ground Guidance-Excessive Steering-Replace Component-1.5hr,FaultCode943,0ZGVF0000002fFI4AY,a85VF000000vQuwYAE,True
0ZGVF0000002fIJ4AY,Linears-Below Ground Guidance-Incorrect Resistance Reading-Replace Component-1.5hr,FaultCode944,0ZGVF0000002fFI4AY,a85VF000000vQv5YAE,True
0ZGVF0000002fIJ4AY,Linears-Below Ground Guidance-Mis-manufactured-Replace Component-1hr,FaultCode945,0ZGVF0000002fFI4AY,a85VF000000vQtqYAE,True
0ZGVF0000002fIJ4AY,Linears-Below Ground Guidance-Other -- Fill in Comments-Replace Component-1.5hr,FaultCode946,0ZGVF0000002fFI4AY,a85VF000000vQvyYAE,True
0ZGVF0000002fIJ4AY,Linears-Below Ground Guidance-Shipment Damage-Replace Component-0hr,FaultCode947,0ZGVF0000002fFI4AY,a85VF000000vQtvYAE,True
0ZGVF0000002fIJ4AY,Linears-Below Ground Guidance-Signal Weak-Replace Component-1.5hr,FaultCode948,0ZGVF0000002fFI4AY,a85VF000000vQvCYAU,True
0ZGVF0000002fIJ4AY,Linears-Below Ground Guidance-Won't Break Safety-Replace Component-1hr,FaultCode949,0ZGVF0000002fFI4AY,a85VF000000vQv1YAE,True
0ZGVF0000002fIJ4AY,Linears-Below Ground Guidance-Won't Hold Safety-Replace Component-1hr,FaultCode950,0ZGVF0000002fFI4AY,a85VF000000vQv2YAE,True
0ZGVF0000002fIJ4AY,Linears-Below Ground Guidance-Won't Steer Forward-Replace Component-1.5hr,FaultCode951,0ZGVF0000002fFI4AY,a85VF000000vQv3YAE,True
0ZGVF0000002fIJ4AY,Linears-Below Ground Guidance-Won't Steer Reverse-Replace Component-1.5hr,FaultCode952,0ZGVF0000002fFI4AY,a85VF000000vQv4YAE,True
0ZGVF0000002fIL4AY,Linears-GPS Guidance-Cable End Failure-Replace Component-1hr,FaultCode953,0ZGVF0000002fFI4AY,a85VF000000vQuvYAE,True
0ZGVF0000002fIL4AY,Linears-GPS Guidance-Mis-manufactured-Replace Component-1hr,FaultCode954,0ZGVF0000002fFI4AY,a85VF000000vQtqYAE,True
0ZGVF0000002fIL4AY,Linears-GPS Guidance-Other -- Fill in Comments-Replace Component-1hr,FaultCode955,0ZGVF0000002fFI4AY,a85VF000000vQttYAE,True
0ZGVF0000002fIL4AY,Linears-GPS Guidance-Shipment Damage-Replace Component-0hr,FaultCode956,0ZGVF0000002fFI4AY,a85VF000000vQtvYAE,True
0ZGVF0000002fIL4AY,Linears-GPS Guidance-Signal Weak-Replace Component-1hr,FaultCode957,0ZGVF0000002fFI4AY,a85VF000000vQuEYAU,True
0ZGVF0000002fIM4AY,Linears-Inlet Components-Dent in Pipe-Replace Component-1hr,FaultCode958,0ZGVF0000002fFI4AY,a85VF000000vQuOYAU,True
0ZGVF0000002fIM4AY,Linears-Inlet Components-Finish Appearance Faulty-Replace Component-1hr,FaultCode959,0ZGVF0000002fFI4AY,a85VF000000vQuPYAU,True
0ZGVF0000002fIM4AY,Linears-Inlet Components-Flanges not Square-Replace Component-1hr,FaultCode960,0ZGVF0000002fFI4AY,a85VF000000vQuQYAU,True
0ZGVF0000002fIM4AY,Linears-Inlet Components-Flanges Out of Time-Replace Component-1hr,FaultCode961,0ZGVF0000002fFI4AY,a85VF000000vQuRYAU,True
0ZGVF0000002fIM4AY,Linears-Inlet Components-Galvanizing Bare Spots-Replace Component-1hr,FaultCode962,0ZGVF0000002fFI4AY,a85VF000000vQuSYAU,True
0ZGVF0000002fIM4AY,Linears-Inlet Components-Galvanizing Excessive-Repair Component-1hr,FaultCode963,0ZGVF0000002fFI4AY,a85VF000000vQxPYAU,True
0ZGVF0000002fIM4AY,Linears-Inlet Components-Galvanizing Quality-Replace Component-1hr,FaultCode964,0ZGVF0000002fFI4AY,a85VF000000vQuTYAU,True
0ZGVF0000002fIM4AY,Linears-Inlet Components-Hole in Pipe-Replace Component-1hr,FaultCode965,0ZGVF0000002fFI4AY,a85VF000000vQuVYAU,True
0ZGVF0000002fIM4AY,Linears-Inlet Components-Hole in Pipe-Weld In Field-1hr,FaultCode966,0ZGVF0000002fFI4AY,a85VF000000vQuZYAU,True
0ZGVF0000002fIM4AY,Linears-Inlet Components-Mis-manufactured-Replace Component-1hr,FaultCode967,0ZGVF0000002fFI4AY,a85VF000000vQtqYAE,True
0ZGVF0000002fIM4AY,Linears-Inlet Components-Other -- Fill in Comments-Replace Component-1hr,FaultCode968,0ZGVF0000002fFI4AY,a85VF000000vQttYAE,True
0ZGVF0000002fIM4AY,Linears-Inlet Components-Part Dimensions Incorrect-Replace Component-1hr,FaultCode969,0ZGVF0000002fFI4AY,a85VF000000vQtuYAE,True
0ZGVF0000002fIM4AY,Linears-Inlet Components-Plug Removal-Remove Plugs-2hr,FaultCode970,0ZGVF0000002fFI4AY,a85VF000000vQueYAE,True
0ZGVF0000002fIM4AY,Linears-Inlet Components-Seam Split-Weld In Field-1hr,FaultCode971,0ZGVF0000002fFI4AY,a85VF000000vQuXYAU,True
0ZGVF0000002fIM4AY,Linears-Inlet Components-Seam Split-Replace Component-1hr,FaultCode972,0ZGVF0000002fFI4AY,a85VF000000vQuWYAU,True
0ZGVF0000002fIM4AY,Linears-Inlet Components-Shipment Damage-Replace Component-0hr,FaultCode973,0ZGVF0000002fFI4AY,a85VF000000vQtvYAE,True
0ZGVF0000002fIM4AY,Linears-Inlet Components-Weld Failure-Weld In Field-1hr,FaultCode974,0ZGVF0000002fFI4AY,a85VF000000vQubYAE,True
0ZGVF0000002fIM4AY,Linears-Inlet Components-Weld Failure-Replace Component-1hr,FaultCode975,0ZGVF0000002fFI4AY,a85VF000000vQuaYAE,True
0ZGVF0000002fIM4AY,Linears-Inlet Components-Weld Missing-Weld In Field-1hr,FaultCode976,0ZGVF0000002fFI4AY,a85VF000000vQvBYAU,True
0ZGVF0000002fIM4AY,Linears-Inlet Components-Weld Missing-Replace Component-1hr,FaultCode977,0ZGVF0000002fFI4AY,a85VF000000vQucYAE,True
0ZGVF0000002fIN4AY,Linears-Linear Alignment-System out of Alignment-Re-align System-2hr,FaultCode978,0ZGVF0000002fFI4AY,a85VF000000vQxQYAU,True
0ZGVF0000002fIN4AY,Linears-Linear Alignment-Other -- Fill in Comments-Replace Component-1hr,FaultCode979,0ZGVF0000002fFI4AY,a85VF000000vQttYAE,True
0ZGVF0000002fIN4AY,Linears-Linear Alignment-Shipment Damage-Replace Component-0hr,FaultCode980,0ZGVF0000002fFI4AY,a85VF000000vQtvYAE,True
0ZGVF0000002fIN4AY,Linears-Linear Alignment-Mis-manufactured-Replace Component-1hr,FaultCode981,0ZGVF0000002fFI4AY,a85VF000000vQtqYAE,True
0ZGVF0000002fIO4AY,Linears-Linear Carts-Finish Appearance Faulty-Replace Component-1hr,FaultCode982,0ZGVF0000002fFI4AY,a85VF000000vQuPYAU,True
0ZGVF0000002fIO4AY,Linears-Linear Carts-Galvanizing Bare Spots-Replace Component-1hr,FaultCode983,0ZGVF0000002fFI4AY,a85VF000000vQuSYAU,True
0ZGVF0000002fIO4AY,Linears-Linear Carts-Galvanizing Excessive-Replace Component-1hr,FaultCode984,0ZGVF0000002fFI4AY,a85VF000000vQuYYAU,True
0ZGVF0000002fIO4AY,Linears-Linear Carts-Galvanizing Quality-Replace Component-1hr,FaultCode985,0ZGVF0000002fFI4AY,a85VF000000vQuTYAU,True
0ZGVF0000002fIO4AY,Linears-Linear Carts-Hitch ball bolt failed-Replace Component-1hr,FaultCode986,0ZGVF0000002fFI4AY,a85VF000000vQuUYAU,True
0ZGVF0000002fIO4AY,Linears-Linear Carts-Mis-manufactured-Replace Component-1hr,FaultCode987,0ZGVF0000002fFI4AY,a85VF000000vQtqYAE,True
0ZGVF0000002fIO4AY,Linears-Linear Carts-Other -- Fill in Comments-Replace Component-1hr,FaultCode988,0ZGVF0000002fFI4AY,a85VF000000vQttYAE,True
0ZGVF0000002fIO4AY,Linears-Linear Carts-Part Dimensions Incorrect-Replace Component-1hr,FaultCode989,0ZGVF0000002fFI4AY,a85VF000000vQtuYAE,True
0ZGVF0000002fIO4AY,Linears-Linear Carts-Seam Split-Replace Component-1hr,FaultCode990,0ZGVF0000002fFI4AY,a85VF000000vQuWYAU,True
0ZGVF0000002fIO4AY,Linears-Linear Carts-Seam Split-Weld In Field-1hr,FaultCode991,0ZGVF0000002fFI4AY,a85VF000000vQuXYAU,True
0ZGVF0000002fIO4AY,Linears-Linear Carts-Shipment Damage-Replace Component-0hr,FaultCode992,0ZGVF0000002fFI4AY,a85VF000000vQtvYAE,True
0ZGVF0000002fIO4AY,Linears-Linear Carts-System out of Alignment-Re-align System-2hr,FaultCode993,0ZGVF0000002fFI4AY,a85VF000000vQxQYAU,True
0ZGVF0000002fIO4AY,Linears-Linear Carts-Weld Failure-Weld In Field-1hr,FaultCode994,0ZGVF0000002fFI4AY,a85VF000000vQubYAE,True
0ZGVF0000002fIO4AY,Linears-Linear Carts-Weld Failure-Replace Component-1hr,FaultCode995,0ZGVF0000002fFI4AY,a85VF000000vQuaYAE,True
0ZGVF0000002fIO4AY,Linears-Linear Carts-Weld Missing-Weld In Field-1hr,FaultCode996,0ZGVF0000002fFI4AY,a85VF000000vQvBYAU,True
0ZGVF0000002fIO4AY,Linears-Linear Carts-Weld Missing-Replace Component-1hr,FaultCode997,0ZGVF0000002fFI4AY,a85VF000000vQucYAE,True
0ZGVF0000002fIP4AY,Linears-Linear Options-Mis-manufactured-Replace Component-1hr,FaultCode998,0ZGVF0000002fFI4AY,a85VF000000vQtqYAE,True
0ZGVF0000002fIP4AY,Linears-Linear Options-Other -- Fill in Comments-Replace Component-1hr,FaultCode999,0ZGVF0000002fFI4AY,a85VF000000vQttYAE,True
0ZGVF0000002fIP4AY,Linears-Linear Options-Shipment Damage-Replace Component-0hr,FaultCode1000,0ZGVF0000002fFI4AY,a85VF000000vQtvYAE,True
0ZGVF0000002fIP4AY,Linears-Linear Options-Signal Weak-Replace Component-1hr,FaultCode1001,0ZGVF0000002fFI4AY,a85VF000000vQuEYAU,True
0ZGVF0000002fIS4AY,Machine Options-Bender Options-Other -- Fill in Comments-Replace Component-1hr,FaultCode1002,0ZGVF0000002fFJ4AY,a85VF000000vQttYAE,True
0ZGVF0000002fIS4AY,Machine Options-Bender Options-Shipment Damage-Replace Component-0hr,FaultCode1003,0ZGVF0000002fFJ4AY,a85VF000000vQtvYAE,True
0ZGVF0000002fIS4AY,Machine Options-Bender Options-Mis-manufactured-Replace Component-1hr,FaultCode1004,0ZGVF0000002fFJ4AY,a85VF000000vQtqYAE,True
0ZGVF0000002fIT4AY,Machine Options-Booster Pumps-120 Volt Input/Output Failure-Replace 2hp BP Motor-2hr,FaultCode1005,0ZGVF0000002fFJ4AY,a85VF000000vQxRYAU,True
0ZGVF0000002fIT4AY,Machine Options-Booster Pumps-120 Volt Input/Output Failure-Replace 2hp BP Complete-2.5hr,FaultCode1006,0ZGVF0000002fFJ4AY,a85VF000000vQxSYAU,True
0ZGVF0000002fIT4AY,Machine Options-Booster Pumps-120 Volt Input/Output Failure-Replace 5 or 7.5 hp BP Motor-2hr,FaultCode1007,0ZGVF0000002fFJ4AY,a85VF000000vQxTYAU,True
0ZGVF0000002fIT4AY,Machine Options-Booster Pumps-120 Volt Input/Output Failure-Replace 5 or 7.5 hp BP Complete-4hr,FaultCode1008,0ZGVF0000002fFJ4AY,a85VF000000vQxUYAU,True
0ZGVF0000002fIT4AY,Machine Options-Booster Pumps-Bearing Seized-Replace 2hp BP Motor-2hr,FaultCode1009,0ZGVF0000002fFJ4AY,a85VF000000vQxVYAU,True
0ZGVF0000002fIT4AY,Machine Options-Booster Pumps-Bearing Seized-Replace 2hp BP Complete-2.5hr,FaultCode1010,0ZGVF0000002fFJ4AY,a85VF000000vQxWYAU,True
0ZGVF0000002fIT4AY,Machine Options-Booster Pumps-Bearing Seized-Replace 5 or 7.5 hp BP Motor-2hr,FaultCode1011,0ZGVF0000002fFJ4AY,a85VF000000vQxXYAU,True
0ZGVF0000002fIT4AY,Machine Options-Booster Pumps-Bearing Seized-Replace 5 or 7.5 hp BP Complete-4hr,FaultCode1012,0ZGVF0000002fFJ4AY,a85VF000000vQxYYAU,True
0ZGVF0000002fIT4AY,Machine Options-Booster Pumps-Corrosion-Replace 2hp BP Motor-2hr,FaultCode1013,0ZGVF0000002fFJ4AY,a85VF000000vQxZYAU,True
0ZGVF0000002fIT4AY,Machine Options-Booster Pumps-Corrosion-Replace 2hp BP Complete-2.5hr,FaultCode1014,0ZGVF0000002fFJ4AY,a85VF000000vQxaYAE,True
0ZGVF0000002fIT4AY,Machine Options-Booster Pumps-Corrosion-Replace 5 or 7.5 hp BP Motor-2hr,FaultCode1015,0ZGVF0000002fFJ4AY,a85VF000000vQxbYAE,True
0ZGVF0000002fIT4AY,Machine Options-Booster Pumps-Corrosion-Replace 5 or 7.5 hp BP Complete-4hr,FaultCode1016,0ZGVF0000002fFJ4AY,a85VF000000vQxcYAE,True
0ZGVF0000002fIT4AY,Machine Options-Booster Pumps-Housing Damaged-Replace 2hp BP Motor-2hr,FaultCode1017,0ZGVF0000002fFJ4AY,a85VF000000vQxdYAE,True
0ZGVF0000002fIT4AY,Machine Options-Booster Pumps-Housing Damaged-Replace 2hp BP Complete-2.5hr,FaultCode1018,0ZGVF0000002fFJ4AY,a85VF000000vQxeYAE,True
0ZGVF0000002fIT4AY,Machine Options-Booster Pumps-Housing Damaged-Replace 5 or 7.5 hp BP Motor-2hr,FaultCode1019,0ZGVF0000002fFJ4AY,a85VF000000vQxfYAE,True
0ZGVF0000002fIT4AY,Machine Options-Booster Pumps-Housing Damaged-Replace 5 or 7.5 hp BP Complete-4hr,FaultCode1020,0ZGVF0000002fFJ4AY,a85VF000000vQxgYAE,True
0ZGVF0000002fIT4AY,Machine Options-Booster Pumps-Impeller Seized-Repair Component-1.5hr,FaultCode1021,0ZGVF0000002fFJ4AY,a85VF000000vQxhYAE,True
0ZGVF0000002fIT4AY,Machine Options-Booster Pumps-Mis-manufactured-Replace Component-1hr,FaultCode1022,0ZGVF0000002fFJ4AY,a85VF000000vQtqYAE,True
0ZGVF0000002fIT4AY,Machine Options-Booster Pumps-Other -- Fill in Comments-Replace Component-1hr,FaultCode1023,0ZGVF0000002fFJ4AY,a85VF000000vQttYAE,True
0ZGVF0000002fIT4AY,Machine Options-Booster Pumps-Shipment Damage-Replace 2hp BP Motor-0hr,FaultCode1024,0ZGVF0000002fFJ4AY,a85VF000000vQxiYAE,True
0ZGVF0000002fIT4AY,Machine Options-Booster Pumps-Shipment Damage-Replace 2hp BP Complete-0hr,FaultCode1025,0ZGVF0000002fFJ4AY,a85VF000000vQxjYAE,True
