Name,WOD_2__Status__c,VRM_External_Id__c,VRM_Category__c,VRM_SubCategory__c,VRM_Failure_Resolution_Code__c
FaultCode853,True,Electrical Components-Fuses & Circuit Breakers-Grounding Block Defective-Replace Component-1hr,0ZGcf0000002Y8wGAE,0ZGcf0000002YErGAM,a83cf0000002qSdAAI
FaultCode854,True,Electrical Components-Fuses & Circuit Breakers-Housing Damaged-Replace Component-1hr,0ZGcf0000002Y8wGAE,0ZGcf0000002YErGAM,a83cf0000002qSeAAI
FaultCode855,True,Electrical Components-Fuses & Circuit Breakers-Intermittent Operations-Replace Component-1hr,0ZGcf0000002Y8wGAE,0ZGcf0000002YErGAM,a83cf0000002qSfAAI
FaultCode856,True,Electrical Components-Fuses & Circuit Breakers-Leads corroded/broken-Replace Component-1hr,0ZGcf0000002Y8wGAE,0ZGcf0000002YErGAM,a83cf0000002qSgAAI
FaultCode857,True,Electrical Components-Fuses & Circuit Breakers-Mis-manufactured-Replace Component-1hr,0ZGcf0000002Y8wGAE,0ZGcf0000002YErGAM,a83cf0000002qSMAAY
FaultCode858,True,Electrical Components-Fuses & Circuit Breakers-Other -- Fill in Comments-Replace Component-1hr,0ZGcf0000002Y8wGAE,0ZGcf0000002YErGAM,a83cf0000002qSPAAY
FaultCode859,True,Electrical Components-Fuses & Circuit Breakers-Shipment Damage-Replace Component-0hr,0ZGcf0000002Y8wGAE,0ZGcf0000002YErGAM,a83cf0000002qSRAAY
FaultCode860,True,Electrical Components-Micro Switches-Factory Wiring Loose-Repair Wiring-1hr,0ZGcf0000002Y8wGAE,0ZGcf0000002YEsGAM,a83cf0000002qTyAAI
FaultCode861,True,Electrical Components-Micro Switches-Mis-manufactured-Replace Component-1hr,0ZGcf0000002Y8wGAE,0ZGcf0000002YEsGAM,a83cf0000002qSMAAY
FaultCode862,True,Electrical Components-Micro Switches-Other -- Fill in Comments-Replace Component-1hr,0ZGcf0000002Y8wGAE,0ZGcf0000002YEsGAM,a83cf0000002qSPAAY
FaultCode863,True,Electrical Components-Micro Switches-Run Microswitch Fails Open-Replace Component-1hr,0ZGcf0000002Y8wGAE,0ZGcf0000002YEsGAM,a83cf0000002qVbAAI
FaultCode864,True,Electrical Components-Micro Switches-Safety Microswitch Fails Closed-Replace Component-1hr,0ZGcf0000002Y8wGAE,0ZGcf0000002YEsGAM,a83cf0000002qVcAAI
FaultCode865,True,Electrical Components-Micro Switches-Shipment Damage-Replace Component-0hr,0ZGcf0000002Y8wGAE,0ZGcf0000002YEsGAM,a83cf0000002qSRAAY
FaultCode866,True,Electrical Components-Micro Switches-Tower Ahead Forward-Replace Component-1hr,0ZGcf0000002Y8wGAE,0ZGcf0000002YEsGAM,a83cf0000002qViAAI
FaultCode867,True,Electrical Components-Micro Switches-Tower Ahead Reverse-Replace Component-1hr,0ZGcf0000002Y8wGAE,0ZGcf0000002YEsGAM,a83cf0000002qVmAAI
FaultCode868,True,Electrical Components-Micro Switches-Tower Behind Forward-Replace Component-1hr,0ZGcf0000002Y8wGAE,0ZGcf0000002YEsGAM,a83cf0000002qVjAAI
FaultCode869,True,Electrical Components-Micro Switches-Tower Behind Reverse-Replace Component-1hr,0ZGcf0000002Y8wGAE,0ZGcf0000002YEsGAM,a83cf0000002qVkAAI
FaultCode870,True,Electrical Components-Percent Timers-Electrical Specs Not Met-Replace Component-1hr,0ZGcf0000002Y8wGAE,0ZGcf0000002YEtGAM,a83cf0000002qSbAAI
FaultCode871,True,Electrical Components-Percent Timers-Factory Wiring Incorrect-Repair Wiring-1hr,0ZGcf0000002Y8wGAE,0ZGcf0000002YEtGAM,a83cf0000002qTfAAI
FaultCode872,True,Electrical Components-Percent Timers-Mis-manufactured-Replace Component-1hr,0ZGcf0000002Y8wGAE,0ZGcf0000002YEtGAM,a83cf0000002qSMAAY
FaultCode873,True,Electrical Components-Percent Timers-Other -- Fill in Comments-Replace Component-1hr,0ZGcf0000002Y8wGAE,0ZGcf0000002YEtGAM,a83cf0000002qSPAAY
FaultCode874,True,Electrical Components-Percent Timers-OW Timer Doesn't Break Safety-Replace Component-1hr,0ZGcf0000002Y8wGAE,0ZGcf0000002YEtGAM,a83cf0000002qVYAAY
FaultCode875,True,Electrical Components-Percent Timers-OW Timer Doesn't Hold Safety-Replace Component-1hr,0ZGcf0000002Y8wGAE,0ZGcf0000002YEtGAM,a83cf0000002qVZAAY
FaultCode876,True,Electrical Components-Percent Timers-Percent timer runs at 100% at all times-Replace Component-1hr,0ZGcf0000002Y8wGAE,0ZGcf0000002YEtGAM,a83cf0000002qTLAAY
FaultCode877,True,Electrical Components-Percent Timers-Shipment Damage-Replace Component-0hr,0ZGcf0000002Y8wGAE,0ZGcf0000002YEtGAM,a83cf0000002qSRAAY
FaultCode878,True,Electrical Components-Power Supply-12 Volt Power Supply-Replace Component-1hr,0ZGcf0000002Y8wGAE,0ZGcf0000002YEuGAM,a83cf0000002qVuAAI
FaultCode879,True,Electrical Components-Power Supply-5 Volt Power Supply-Replace Component-1hr,0ZGcf0000002Y8wGAE,0ZGcf0000002YEuGAM,a83cf0000002qTCAAY
FaultCode880,True,Electrical Components-Power Supply-Mis-manufactured-Replace Component-1hr,0ZGcf0000002Y8wGAE,0ZGcf0000002YEuGAM,a83cf0000002qSMAAY
FaultCode881,True,Electrical Components-Power Supply-Other -- Fill in Comments-Replace Component-1hr,0ZGcf0000002Y8wGAE,0ZGcf0000002YEuGAM,a83cf0000002qSPAAY
FaultCode882,True,Electrical Components-Power Supply-Shipment Damage-Replace Component-0hr,0ZGcf0000002Y8wGAE,0ZGcf0000002YEuGAM,a83cf0000002qSRAAY
FaultCode883,True,Electrical Components-Pressure Switches-Electrical Component Failure-Replace Component-1hr,0ZGcf0000002Y8wGAE,0ZGcf0000002YF3GAM,a83cf0000002qSaAAI
FaultCode884,True,Electrical Components-Pressure Switches-Electrical Specs Not Met-Replace Component-1hr,0ZGcf0000002Y8wGAE,0ZGcf0000002YF3GAM,a83cf0000002qSbAAI
FaultCode885,True,Electrical Components-Pressure Switches-Low Pressure Switch Fails Closed-Replace Component-1hr,0ZGcf0000002Y8wGAE,0ZGcf0000002YF3GAM,a83cf0000002qTlAAI
FaultCode886,True,Electrical Components-Pressure Switches-Low Pressure Switch Fails Open-Replace Component-1hr,0ZGcf0000002Y8wGAE,0ZGcf0000002YF3GAM,a83cf0000002qTmAAI
FaultCode887,True,Electrical Components-Pressure Switches-Mis-manufactured-Replace Component-1hr,0ZGcf0000002Y8wGAE,0ZGcf0000002YF3GAM,a83cf0000002qSMAAY
FaultCode888,True,Electrical Components-Pressure Switches-Other -- Fill in Comments-Replace Component-1hr,0ZGcf0000002Y8wGAE,0ZGcf0000002YF3GAM,a83cf0000002qSPAAY
FaultCode889,True,Electrical Components-Pressure Switches-Shipment Damage-Replace Component-0hr,0ZGcf0000002Y8wGAE,0ZGcf0000002YF3GAM,a83cf0000002qSRAAY
FaultCode890,True,Electrical Components-Pressure Switches-Switch Failure-Replace Component-1hr,0ZGcf0000002Y8wGAE,0ZGcf0000002YF3GAM,a83cf0000002qTnAAI
FaultCode891,True,Electrical Components-Pressure Transducers-Calibration changed/out of spec-Replace Component-1hr,0ZGcf0000002Y8wGAE,0ZGcf0000002YEvGAM,a83cf0000002qSTAAY
FaultCode892,True,Electrical Components-Pressure Transducers-Leads corroded/broken-Replace Component-1hr,0ZGcf0000002Y8wGAE,0ZGcf0000002YEvGAM,a83cf0000002qSgAAI
FaultCode893,True,Electrical Components-Pressure Transducers-Mis-manufactured-Replace Component-1hr,0ZGcf0000002Y8wGAE,0ZGcf0000002YEvGAM,a83cf0000002qSMAAY
FaultCode894,True,Electrical Components-Pressure Transducers-Other -- Fill in Comments-Replace Component-1hr,0ZGcf0000002Y8wGAE,0ZGcf0000002YEvGAM,a83cf0000002qSPAAY
FaultCode895,True,Electrical Components-Pressure Transducers-Pressure Reading Incorrect-Replace Component-1hr,0ZGcf0000002Y8wGAE,0ZGcf0000002YEvGAM,a83cf0000002qTMAAY
FaultCode896,True,Electrical Components-Pressure Transducers-Shipment Damage-Replace Component-0hr,0ZGcf0000002Y8wGAE,0ZGcf0000002YEvGAM,a83cf0000002qSRAAY
FaultCode897,True,Electrical Components-Relays-Calibration changed/out of spec-Replace Component-1hr,0ZGcf0000002Y8wGAE,0ZGcf0000002YEwGAM,a83cf0000002qSTAAY
FaultCode898,True,Electrical Components-Relays-Coil Failure-Replace Component-1hr,0ZGcf0000002Y8wGAE,0ZGcf0000002YEwGAM,a83cf0000002qSLAAY
FaultCode899,True,Electrical Components-Relays-Contact Points Burned-Replace Component-1hr,0ZGcf0000002Y8wGAE,0ZGcf0000002YEwGAM,a83cf0000002qSUAAY
FaultCode900,True,Electrical Components-Relays-Contact Points Damaged-Replace Component-1hr,0ZGcf0000002Y8wGAE,0ZGcf0000002YEwGAM,a83cf0000002qTkAAI
FaultCode901,True,Electrical Components-Relays-Electrical Component Failure-Replace Component-1hr,0ZGcf0000002Y8wGAE,0ZGcf0000002YEwGAM,a83cf0000002qSaAAI
FaultCode902,True,Electrical Components-Relays-Electrical Specs Not Met-Replace Component-1hr,0ZGcf0000002Y8wGAE,0ZGcf0000002YEwGAM,a83cf0000002qSbAAI
FaultCode903,True,Electrical Components-Relays-Factory Wiring Incorrect-Replace Component-1hr,0ZGcf0000002Y8wGAE,0ZGcf0000002YEwGAM,a83cf0000002qTjAAI
FaultCode904,True,Electrical Components-Relays-Factory Wiring Incorrect-Repair Wiring-1hr,0ZGcf0000002Y8wGAE,0ZGcf0000002YEwGAM,a83cf0000002qTfAAI
FaultCode905,True,Electrical Components-Relays-Factory Wiring Loose-Repair Wiring-1hr,0ZGcf0000002Y8wGAE,0ZGcf0000002YEwGAM,a83cf0000002qTyAAI
FaultCode906,True,Electrical Components-Relays-Intermittent Operations-Replace Component-1hr,0ZGcf0000002Y8wGAE,0ZGcf0000002YEwGAM,a83cf0000002qSfAAI
FaultCode907,True,Electrical Components-Relays-Mis-manufactured-Replace Component-1hr,0ZGcf0000002Y8wGAE,0ZGcf0000002YEwGAM,a83cf0000002qSMAAY
FaultCode908,True,Electrical Components-Relays-Other -- Fill in Comments-Replace Component-1hr,0ZGcf0000002Y8wGAE,0ZGcf0000002YEwGAM,a83cf0000002qSPAAY
FaultCode909,True,Electrical Components-Relays-Shipment Damage-Replace Component-0hr,0ZGcf0000002Y8wGAE,0ZGcf0000002YEwGAM,a83cf0000002qSRAAY
FaultCode910,True,Electrical Components-Solenoids-Coil Failure-Replace Component-1hr,0ZGcf0000002Y8wGAE,0ZGcf0000002YExGAM,a83cf0000002qSLAAY
FaultCode911,True,Electrical Components-Solenoids-Leaking-Replace Component-1hr,0ZGcf0000002Y8wGAE,0ZGcf0000002YExGAM,a83cf0000002qSNAAY
FaultCode912,True,Electrical Components-Solenoids-Other -- Fill in Comments-Replace Component-1hr,0ZGcf0000002Y8wGAE,0ZGcf0000002YExGAM,a83cf0000002qSPAAY
FaultCode913,True,Electrical Components-Solenoids-Shipment Damage-Replace Component-0hr,0ZGcf0000002Y8wGAE,0ZGcf0000002YExGAM,a83cf0000002qSRAAY
FaultCode914,True,Electrical Components-Solenoids-Won't close-Replace Component-1hr,0ZGcf0000002Y8wGAE,0ZGcf0000002YExGAM,a83cf0000002qSOAAY
FaultCode915,True,Electrical Components-Speciality Cables-Other -- Fill in Comments-Replace Component-1hr,0ZGcf0000002Y8wGAE,0ZGcf0000002YEyGAM,a83cf0000002qSPAAY
FaultCode916,True,Electrical Components-Speciality Cables-Shipment Damage-Replace Component-0hr,0ZGcf0000002Y8wGAE,0ZGcf0000002YEyGAM,a83cf0000002qSRAAY
FaultCode917,True,Electrical Components-Speciality Cables-Mis-manufactured-Replace Component-1hr,0ZGcf0000002Y8wGAE,0ZGcf0000002YEyGAM,a83cf0000002qSMAAY
FaultCode918,True,Electrical Components-Switches-Calibration changed/out of spec-Replace Component-1hr,0ZGcf0000002Y8wGAE,0ZGcf0000002YEzGAM,a83cf0000002qSTAAY
FaultCode919,True,Electrical Components-Switches-Contact Points Burned-Replace Component-1hr,0ZGcf0000002Y8wGAE,0ZGcf0000002YEzGAM,a83cf0000002qSUAAY
FaultCode920,True,Electrical Components-Switches-Contact Points Damaged-Replace Component-1hr,0ZGcf0000002Y8wGAE,0ZGcf0000002YEzGAM,a83cf0000002qTkAAI
FaultCode921,True,Electrical Components-Switches-Electrical Specs Not Met-Replace Component-1hr,0ZGcf0000002Y8wGAE,0ZGcf0000002YEzGAM,a83cf0000002qSbAAI
FaultCode922,True,Electrical Components-Switches-Intermittent Operations-Replace Component-1hr,0ZGcf0000002Y8wGAE,0ZGcf0000002YEzGAM,a83cf0000002qSfAAI
FaultCode923,True,Electrical Components-Switches-Leads corroded/broken-Replace Component-1hr,0ZGcf0000002Y8wGAE,0ZGcf0000002YEzGAM,a83cf0000002qSgAAI
FaultCode924,True,Electrical Components-Switches-Mis-manufactured-Replace Component-1hr,0ZGcf0000002Y8wGAE,0ZGcf0000002YEzGAM,a83cf0000002qSMAAY
FaultCode925,True,Electrical Components-Switches-Other -- Fill in Comments-Replace Component-1hr,0ZGcf0000002Y8wGAE,0ZGcf0000002YEzGAM,a83cf0000002qSPAAY
FaultCode926,True,Electrical Components-Switches-Shipment Damage-Replace Component-0hr,0ZGcf0000002Y8wGAE,0ZGcf0000002YEzGAM,a83cf0000002qSRAAY
FaultCode927,True,Electrical Components-Terminal Options-Calibration changed/out of spec-Replace Component-1hr,0ZGcf0000002Y8wGAE,0ZGcf0000002YF4GAM,a83cf0000002qSTAAY
FaultCode928,True,Electrical Components-Terminal Options-Contact Points Burned-Replace Component-1hr,0ZGcf0000002Y8wGAE,0ZGcf0000002YF4GAM,a83cf0000002qSUAAY
FaultCode929,True,Electrical Components-Terminal Options-Contactor not pulling in-Replace Component-1hr,0ZGcf0000002Y8wGAE,0ZGcf0000002YF4GAM,a83cf0000002qSXAAY
FaultCode930,True,Electrical Components-Terminal Options-Electrical Component Failure-Replace Component-1hr,0ZGcf0000002Y8wGAE,0ZGcf0000002YF4GAM,a83cf0000002qSaAAI
FaultCode931,True,Electrical Components-Terminal Options-Electrical Specs Not Met-Replace Component-1hr,0ZGcf0000002Y8wGAE,0ZGcf0000002YF4GAM,a83cf0000002qSbAAI
FaultCode932,True,Electrical Components-Terminal Options-Fuse Block Defective-Replace Component-1hr,0ZGcf0000002Y8wGAE,0ZGcf0000002YF4GAM,a83cf0000002qScAAI
FaultCode933,True,Electrical Components-Terminal Options-Grounding Block Defective-Replace Component-1hr,0ZGcf0000002Y8wGAE,0ZGcf0000002YF4GAM,a83cf0000002qSdAAI
FaultCode934,True,Electrical Components-Terminal Options-Housing Damaged-Replace Component-1hr,0ZGcf0000002Y8wGAE,0ZGcf0000002YF4GAM,a83cf0000002qSeAAI
FaultCode935,True,Electrical Components-Terminal Options-Intermittent Operations-Replace Component-1hr,0ZGcf0000002Y8wGAE,0ZGcf0000002YF4GAM,a83cf0000002qSfAAI
FaultCode936,True,Electrical Components-Terminal Options-Leads corroded/broken-Replace Component-1hr,0ZGcf0000002Y8wGAE,0ZGcf0000002YF4GAM,a83cf0000002qSgAAI
FaultCode937,True,Electrical Components-Terminal Options-Mis-manufactured-Replace Component-1hr,0ZGcf0000002Y8wGAE,0ZGcf0000002YF4GAM,a83cf0000002qSMAAY
FaultCode938,True,Electrical Components-Terminal Options-Other -- Fill in Comments-Replace Component-1hr,0ZGcf0000002Y8wGAE,0ZGcf0000002YF4GAM,a83cf0000002qSPAAY
FaultCode939,True,Electrical Components-Terminal Options-Shipment Damage-Replace Component-0hr,0ZGcf0000002Y8wGAE,0ZGcf0000002YF4GAM,a83cf0000002qSRAAY
FaultCode940,True,Flotation-Articulating 4-Wheel Drive-Other -- Fill in Comments-Replace Component-1hr,0ZGcf0000002Y8xGAE,0ZGcf0000002YF7GAM,a83cf0000002qSPAAY
FaultCode941,True,Flotation-Articulating 4-Wheel Drive-Shipment Damage-Replace Component-0hr,0ZGcf0000002Y8xGAE,0ZGcf0000002YF7GAM,a83cf0000002qSRAAY
FaultCode942,True,Flotation-Articulating 4-Wheel Drive-Mis-manufactured-Replace Component-1hr,0ZGcf0000002Y8xGAE,0ZGcf0000002YF7GAM,a83cf0000002qSMAAY
FaultCode943,True,Linears-Below Ground Guidance-Excessive Steering-Replace Component-1.5hr,0ZGcf0000002Y8yGAE,0ZGcf0000002YFDGA2,a83cf0000002qTSAAY
FaultCode944,True,Linears-Below Ground Guidance-Incorrect Resistance Reading-Replace Component-1.5hr,0ZGcf0000002Y8yGAE,0ZGcf0000002YFDGA2,a83cf0000002qTbAAI
FaultCode945,True,Linears-Below Ground Guidance-Mis-manufactured-Replace Component-1hr,0ZGcf0000002Y8yGAE,0ZGcf0000002YFDGA2,a83cf0000002qSMAAY
FaultCode946,True,Linears-Below Ground Guidance-Other -- Fill in Comments-Replace Component-1.5hr,0ZGcf0000002Y8yGAE,0ZGcf0000002YFDGA2,a83cf0000002qUUAAY
FaultCode947,True,Linears-Below Ground Guidance-Shipment Damage-Replace Component-0hr,0ZGcf0000002Y8yGAE,0ZGcf0000002YFDGA2,a83cf0000002qSRAAY
FaultCode948,True,Linears-Below Ground Guidance-Signal Weak-Replace Component-1.5hr,0ZGcf0000002Y8yGAE,0ZGcf0000002YFDGA2,a83cf0000002qTiAAI
FaultCode949,True,Linears-Below Ground Guidance-Won't Break Safety-Replace Component-1hr,0ZGcf0000002Y8yGAE,0ZGcf0000002YFDGA2,a83cf0000002qTXAAY
FaultCode950,True,Linears-Below Ground Guidance-Won't Hold Safety-Replace Component-1hr,0ZGcf0000002Y8yGAE,0ZGcf0000002YFDGA2,a83cf0000002qTYAAY
FaultCode951,True,Linears-Below Ground Guidance-Won't Steer Forward-Replace Component-1.5hr,0ZGcf0000002Y8yGAE,0ZGcf0000002YFDGA2,a83cf0000002qTZAAY
FaultCode952,True,Linears-Below Ground Guidance-Won't Steer Reverse-Replace Component-1.5hr,0ZGcf0000002Y8yGAE,0ZGcf0000002YFDGA2,a83cf0000002qTaAAI
FaultCode953,True,Linears-GPS Guidance-Cable End Failure-Replace Component-1hr,0ZGcf0000002Y8yGAE,0ZGcf0000002YFFGA2,a83cf0000002qTRAAY
FaultCode954,True,Linears-GPS Guidance-Mis-manufactured-Replace Component-1hr,0ZGcf0000002Y8yGAE,0ZGcf0000002YFFGA2,a83cf0000002qSMAAY
FaultCode955,True,Linears-GPS Guidance-Other -- Fill in Comments-Replace Component-1hr,0ZGcf0000002Y8yGAE,0ZGcf0000002YFFGA2,a83cf0000002qSPAAY
FaultCode956,True,Linears-GPS Guidance-Shipment Damage-Replace Component-0hr,0ZGcf0000002Y8yGAE,0ZGcf0000002YFFGA2,a83cf0000002qSRAAY
FaultCode957,True,Linears-GPS Guidance-Signal Weak-Replace Component-1hr,0ZGcf0000002Y8yGAE,0ZGcf0000002YFFGA2,a83cf0000002qSkAAI
FaultCode958,True,Linears-Inlet Components-Dent in Pipe-Replace Component-1hr,0ZGcf0000002Y8yGAE,0ZGcf0000002YFGGA2,a83cf0000002qSuAAI
FaultCode959,True,Linears-Inlet Components-Finish Appearance Faulty-Replace Component-1hr,0ZGcf0000002Y8yGAE,0ZGcf0000002YFGGA2,a83cf0000002qSvAAI
FaultCode960,True,Linears-Inlet Components-Flanges not Square-Replace Component-1hr,0ZGcf0000002Y8yGAE,0ZGcf0000002YFGGA2,a83cf0000002qSwAAI
FaultCode961,True,Linears-Inlet Components-Flanges Out of Time-Replace Component-1hr,0ZGcf0000002Y8yGAE,0ZGcf0000002YFGGA2,a83cf0000002qSxAAI
FaultCode962,True,Linears-Inlet Components-Galvanizing Bare Spots-Replace Component-1hr,0ZGcf0000002Y8yGAE,0ZGcf0000002YFGGA2,a83cf0000002qSyAAI
FaultCode963,True,Linears-Inlet Components-Galvanizing Excessive-Repair Component-1hr,0ZGcf0000002Y8yGAE,0ZGcf0000002YFGGA2,a83cf0000002qVvAAI
FaultCode964,True,Linears-Inlet Components-Galvanizing Quality-Replace Component-1hr,0ZGcf0000002Y8yGAE,0ZGcf0000002YFGGA2,a83cf0000002qSzAAI
FaultCode965,True,Linears-Inlet Components-Hole in Pipe-Replace Component-1hr,0ZGcf0000002Y8yGAE,0ZGcf0000002YFGGA2,a83cf0000002qT1AAI
FaultCode966,True,Linears-Inlet Components-Hole in Pipe-Weld In Field-1hr,0ZGcf0000002Y8yGAE,0ZGcf0000002YFGGA2,a83cf0000002qT5AAI
FaultCode967,True,Linears-Inlet Components-Mis-manufactured-Replace Component-1hr,0ZGcf0000002Y8yGAE,0ZGcf0000002YFGGA2,a83cf0000002qSMAAY
FaultCode968,True,Linears-Inlet Components-Other -- Fill in Comments-Replace Component-1hr,0ZGcf0000002Y8yGAE,0ZGcf0000002YFGGA2,a83cf0000002qSPAAY
FaultCode969,True,Linears-Inlet Components-Part Dimensions Incorrect-Replace Component-1hr,0ZGcf0000002Y8yGAE,0ZGcf0000002YFGGA2,a83cf0000002qSQAAY
FaultCode970,True,Linears-Inlet Components-Plug Removal-Remove Plugs-2hr,0ZGcf0000002Y8yGAE,0ZGcf0000002YFGGA2,a83cf0000002qTAAAY
FaultCode971,True,Linears-Inlet Components-Seam Split-Weld In Field-1hr,0ZGcf0000002Y8yGAE,0ZGcf0000002YFGGA2,a83cf0000002qT3AAI
FaultCode972,True,Linears-Inlet Components-Seam Split-Replace Component-1hr,0ZGcf0000002Y8yGAE,0ZGcf0000002YFGGA2,a83cf0000002qT2AAI
FaultCode973,True,Linears-Inlet Components-Shipment Damage-Replace Component-0hr,0ZGcf0000002Y8yGAE,0ZGcf0000002YFGGA2,a83cf0000002qSRAAY
FaultCode974,True,Linears-Inlet Components-Weld Failure-Weld In Field-1hr,0ZGcf0000002Y8yGAE,0ZGcf0000002YFGGA2,a83cf0000002qT7AAI
FaultCode975,True,Linears-Inlet Components-Weld Failure-Replace Component-1hr,0ZGcf0000002Y8yGAE,0ZGcf0000002YFGGA2,a83cf0000002qT6AAI
FaultCode976,True,Linears-Inlet Components-Weld Missing-Weld In Field-1hr,0ZGcf0000002Y8yGAE,0ZGcf0000002YFGGA2,a83cf0000002qThAAI
FaultCode977,True,Linears-Inlet Components-Weld Missing-Replace Component-1hr,0ZGcf0000002Y8yGAE,0ZGcf0000002YFGGA2,a83cf0000002qT8AAI
FaultCode978,True,Linears-Linear Alignment-System out of Alignment-Re-align System-2hr,0ZGcf0000002Y8yGAE,0ZGcf0000002YFHGA2,a83cf0000002qVwAAI
FaultCode979,True,Linears-Linear Alignment-Other -- Fill in Comments-Replace Component-1hr,0ZGcf0000002Y8yGAE,0ZGcf0000002YFHGA2,a83cf0000002qSPAAY
FaultCode980,True,Linears-Linear Alignment-Shipment Damage-Replace Component-0hr,0ZGcf0000002Y8yGAE,0ZGcf0000002YFHGA2,a83cf0000002qSRAAY
FaultCode981,True,Linears-Linear Alignment-Mis-manufactured-Replace Component-1hr,0ZGcf0000002Y8yGAE,0ZGcf0000002YFHGA2,a83cf0000002qSMAAY
FaultCode982,True,Linears-Linear Carts-Finish Appearance Faulty-Replace Component-1hr,0ZGcf0000002Y8yGAE,0ZGcf0000002YFIGA2,a83cf0000002qSvAAI
FaultCode983,True,Linears-Linear Carts-Galvanizing Bare Spots-Replace Component-1hr,0ZGcf0000002Y8yGAE,0ZGcf0000002YFIGA2,a83cf0000002qSyAAI
FaultCode984,True,Linears-Linear Carts-Galvanizing Excessive-Replace Component-1hr,0ZGcf0000002Y8yGAE,0ZGcf0000002YFIGA2,a83cf0000002qT4AAI
FaultCode985,True,Linears-Linear Carts-Galvanizing Quality-Replace Component-1hr,0ZGcf0000002Y8yGAE,0ZGcf0000002YFIGA2,a83cf0000002qSzAAI
FaultCode986,True,Linears-Linear Carts-Hitch ball bolt failed-Replace Component-1hr,0ZGcf0000002Y8yGAE,0ZGcf0000002YFIGA2,a83cf0000002qT0AAI
FaultCode987,True,Linears-Linear Carts-Mis-manufactured-Replace Component-1hr,0ZGcf0000002Y8yGAE,0ZGcf0000002YFIGA2,a83cf0000002qSMAAY
FaultCode988,True,Linears-Linear Carts-Other -- Fill in Comments-Replace Component-1hr,0ZGcf0000002Y8yGAE,0ZGcf0000002YFIGA2,a83cf0000002qSPAAY
FaultCode989,True,Linears-Linear Carts-Part Dimensions Incorrect-Replace Component-1hr,0ZGcf0000002Y8yGAE,0ZGcf0000002YFIGA2,a83cf0000002qSQAAY
FaultCode990,True,Linears-Linear Carts-Seam Split-Replace Component-1hr,0ZGcf0000002Y8yGAE,0ZGcf0000002YFIGA2,a83cf0000002qT2AAI
FaultCode991,True,Linears-Linear Carts-Seam Split-Weld In Field-1hr,0ZGcf0000002Y8yGAE,0ZGcf0000002YFIGA2,a83cf0000002qT3AAI
FaultCode992,True,Linears-Linear Carts-Shipment Damage-Replace Component-0hr,0ZGcf0000002Y8yGAE,0ZGcf0000002YFIGA2,a83cf0000002qSRAAY
FaultCode993,True,Linears-Linear Carts-System out of Alignment-Re-align System-2hr,0ZGcf0000002Y8yGAE,0ZGcf0000002YFIGA2,a83cf0000002qVwAAI
FaultCode994,True,Linears-Linear Carts-Weld Failure-Weld In Field-1hr,0ZGcf0000002Y8yGAE,0ZGcf0000002YFIGA2,a83cf0000002qT7AAI
FaultCode995,True,Linears-Linear Carts-Weld Failure-Replace Component-1hr,0ZGcf0000002Y8yGAE,0ZGcf0000002YFIGA2,a83cf0000002qT6AAI
FaultCode996,True,Linears-Linear Carts-Weld Missing-Weld In Field-1hr,0ZGcf0000002Y8yGAE,0ZGcf0000002YFIGA2,a83cf0000002qThAAI
FaultCode997,True,Linears-Linear Carts-Weld Missing-Replace Component-1hr,0ZGcf0000002Y8yGAE,0ZGcf0000002YFIGA2,a83cf0000002qT8AAI
FaultCode998,True,Linears-Linear Options-Mis-manufactured-Replace Component-1hr,0ZGcf0000002Y8yGAE,0ZGcf0000002YFJGA2,a83cf0000002qSMAAY
FaultCode999,True,Linears-Linear Options-Other -- Fill in Comments-Replace Component-1hr,0ZGcf0000002Y8yGAE,0ZGcf0000002YFJGA2,a83cf0000002qSPAAY
FaultCode1000,True,Linears-Linear Options-Shipment Damage-Replace Component-0hr,0ZGcf0000002Y8yGAE,0ZGcf0000002YFJGA2,a83cf0000002qSRAAY
FaultCode1001,True,Linears-Linear Options-Signal Weak-Replace Component-1hr,0ZGcf0000002Y8yGAE,0ZGcf0000002YFJGA2,a83cf0000002qSkAAI
FaultCode1002,True,Machine Options-Bender Options-Other -- Fill in Comments-Replace Component-1hr,0ZGcf0000002Y8zGAE,0ZGcf0000002YFMGA2,a83cf0000002qSPAAY
FaultCode1003,True,Machine Options-Bender Options-Shipment Damage-Replace Component-0hr,0ZGcf0000002Y8zGAE,0ZGcf0000002YFMGA2,a83cf0000002qSRAAY
FaultCode1004,True,Machine Options-Bender Options-Mis-manufactured-Replace Component-1hr,0ZGcf0000002Y8zGAE,0ZGcf0000002YFMGA2,a83cf0000002qSMAAY
FaultCode1005,True,Machine Options-Booster Pumps-120 Volt Input/Output Failure-Replace 2hp BP Motor-2hr,0ZGcf0000002Y8zGAE,0ZGcf0000002YFNGA2,a83cf0000002qVxAAI
FaultCode1006,True,Machine Options-Booster Pumps-120 Volt Input/Output Failure-Replace 2hp BP Complete-2.5hr,0ZGcf0000002Y8zGAE,0ZGcf0000002YFNGA2,a83cf0000002qVyAAI
FaultCode1007,True,Machine Options-Booster Pumps-120 Volt Input/Output Failure-Replace 5 or 7.5 hp BP Motor-2hr,0ZGcf0000002Y8zGAE,0ZGcf0000002YFNGA2,a83cf0000002qVzAAI
FaultCode1008,True,Machine Options-Booster Pumps-120 Volt Input/Output Failure-Replace 5 or 7.5 hp BP Complete-4hr,0ZGcf0000002Y8zGAE,0ZGcf0000002YFNGA2,a83cf0000002qW0AAI
FaultCode1009,True,Machine Options-Booster Pumps-Bearing Seized-Replace 2hp BP Motor-2hr,0ZGcf0000002Y8zGAE,0ZGcf0000002YFNGA2,a83cf0000002qW1AAI
FaultCode1010,True,Machine Options-Booster Pumps-Bearing Seized-Replace 2hp BP Complete-2.5hr,0ZGcf0000002Y8zGAE,0ZGcf0000002YFNGA2,a83cf0000002qW2AAI
FaultCode1011,True,Machine Options-Booster Pumps-Bearing Seized-Replace 5 or 7.5 hp BP Motor-2hr,0ZGcf0000002Y8zGAE,0ZGcf0000002YFNGA2,a83cf0000002qW3AAI
FaultCode1012,True,Machine Options-Booster Pumps-Bearing Seized-Replace 5 or 7.5 hp BP Complete-4hr,0ZGcf0000002Y8zGAE,0ZGcf0000002YFNGA2,a83cf0000002qW4AAI
FaultCode1013,True,Machine Options-Booster Pumps-Corrosion-Replace 2hp BP Motor-2hr,0ZGcf0000002Y8zGAE,0ZGcf0000002YFNGA2,a83cf0000002qW5AAI
FaultCode1014,True,Machine Options-Booster Pumps-Corrosion-Replace 2hp BP Complete-2.5hr,0ZGcf0000002Y8zGAE,0ZGcf0000002YFNGA2,a83cf0000002qW6AAI
FaultCode1015,True,Machine Options-Booster Pumps-Corrosion-Replace 5 or 7.5 hp BP Motor-2hr,0ZGcf0000002Y8zGAE,0ZGcf0000002YFNGA2,a83cf0000002qW7AAI
FaultCode1016,True,Machine Options-Booster Pumps-Corrosion-Replace 5 or 7.5 hp BP Complete-4hr,0ZGcf0000002Y8zGAE,0ZGcf0000002YFNGA2,a83cf0000002qW8AAI
FaultCode1017,True,Machine Options-Booster Pumps-Housing Damaged-Replace 2hp BP Motor-2hr,0ZGcf0000002Y8zGAE,0ZGcf0000002YFNGA2,a83cf0000002qW9AAI
FaultCode1018,True,Machine Options-Booster Pumps-Housing Damaged-Replace 2hp BP Complete-2.5hr,0ZGcf0000002Y8zGAE,0ZGcf0000002YFNGA2,a83cf0000002qWAAAY
FaultCode1019,True,Machine Options-Booster Pumps-Housing Damaged-Replace 5 or 7.5 hp BP Motor-2hr,0ZGcf0000002Y8zGAE,0ZGcf0000002YFNGA2,a83cf0000002qWBAAY
FaultCode1020,True,Machine Options-Booster Pumps-Housing Damaged-Replace 5 or 7.5 hp BP Complete-4hr,0ZGcf0000002Y8zGAE,0ZGcf0000002YFNGA2,a83cf0000002qWCAAY
FaultCode1021,True,Machine Options-Booster Pumps-Impeller Seized-Repair Component-1.5hr,0ZGcf0000002Y8zGAE,0ZGcf0000002YFNGA2,a83cf0000002qWDAAY
FaultCode1022,True,Machine Options-Booster Pumps-Mis-manufactured-Replace Component-1hr,0ZGcf0000002Y8zGAE,0ZGcf0000002YFNGA2,a83cf0000002qSMAAY
FaultCode1023,True,Machine Options-Booster Pumps-Other -- Fill in Comments-Replace Component-1hr,0ZGcf0000002Y8zGAE,0ZGcf0000002YFNGA2,a83cf0000002qSPAAY
FaultCode1024,True,Machine Options-Booster Pumps-Shipment Damage-Replace 2hp BP Motor-0hr,0ZGcf0000002Y8zGAE,0ZGcf0000002YFNGA2,a83cf0000002qWEAAY
FaultCode1025,True,Machine Options-Booster Pumps-Shipment Damage-Replace 2hp BP Complete-0hr,0ZGcf0000002Y8zGAE,0ZGcf0000002YFNGA2,a83cf0000002qWFAAY
